code,parent,label_en
A,,"AGRICULTURE, FORESTRY AND FISHING"
01,A,"Crop and animal production, hunting and related service activities"
011,01,Growing of non-perennial crops
0111,011,"Growing of cereals, other than rice, leguminous crops and oil seeds"
0112,011,Growing of rice
0113,011,"Growing of vegetables and melons, roots and tubers"
0114,011,Growing of sugar cane
0115,011,Growing of tobacco
0116,011,Growing of fibre crops
0119,011,Growing of other non-perennial crops
012,01,Growing of perennial crops
0121,012,Growing of grapes
0122,012,Growing of tropical and subtropical fruits
0123,012,Growing of citrus fruits
0124,012,Growing of pome fruits and stone fruits
0125,012,Growing of other tree and bush fruits and nuts
0126,012,Growing of oleaginous fruits
0127,012,Growing of beverage crops
0128,012,"Growing of spices, aromatic, drug and pharmaceutical crops"
0129,012,Growing of other perennial crops
013,01,Plant propagation
0130,013,Plant propagation
014,01,Animal production
0141,014,Raising of dairy cattle
0142,014,Raising of other cattle and buffaloes
0143,014,Raising of horses and other equines
0144,014,Raising of camels and camelids
0145,014,Raising of sheep and goats
0146,014,Raising of swine and pigs
0147,014,Raising of poultry
0148,014,Raising of other animals
015,01,Mixed farming
0150,015,Mixed farming
016,01,Support activities to agriculture and post-harvest crop activities
0161,016,Support activities for crop production
0162,016,Support activities for animal production
0163,016,Post-harvest crop activities and seed processing for propagation
017,01,"Hunting, trapping and related service activities"
0170,017,"Hunting, trapping and related service activities"
02,A,Forestry and logging
021,02,Silviculture and other forestry activities
0210,021,Silviculture and other forestry activities
022,02,Logging
0220,022,Logging
023,02,Gathering of wild growing non-wood products
0230,023,Gathering of wild growing non-wood products
024,02,Support services to forestry
0240,024,Support services to forestry
03,A,Fishing and aquaculture
031,03,Fishing
0311,031,Marine fishing
0312,031,Freshwater fishing
032,03,Aquaculture
0321,032,Marine aquaculture
0322,032,Freshwater aquaculture
033,03,Support activities for fishing and aquaculture
0330,033,Support activities for fishing and aquaculture
B,,MINING AND QUARRYING
05,B,Mining of coal and lignite
051,05,Mining of hard coal
0510,051,Mining of hard coal
052,05,Mining of lignite
0520,052,Mining of lignite
06,B,Extraction of crude petroleum and natural gas
061,06,Extraction of crude petroleum
0610,061,Extraction of crude petroleum
062,06,Extraction of natural gas
0620,062,Extraction of natural gas
07,B,Mining of metal ores
071,07,Mining of iron ores
0710,071,Mining of iron ores
072,07,Mining of non-ferrous metal ores
0721,072,Mining of uranium and thorium ores
0729,072,Mining of other non-ferrous metal ores
08,B,Other mining and quarrying
081,08,"Quarrying of stone, sand and clay"
0811,081,"Quarrying of ornamental stone, limestone, gypsum, slate and other stone"
0812,081,Operation of gravel and sand pits and mining of clay and kaolin
089,08,Mining and quarrying n.e.c.
0891,089,Mining of chemical and fertiliser minerals
0892,089,Extraction of peat
0893,089,Extraction of salt
0899,089,Other mining and quarrying n.e.c.
09,B,Mining support service activities
091,09,Support activities for petroleum and natural gas extraction
0910,091,Support activities for petroleum and natural gas extraction
099,09,Support activities for other mining and quarrying
0990,099,Support activities for other mining and quarrying
C,,MANUFACTURING
10,C,Manufacture of food products
101,10,Processing and preserving of meat and production of meat products
1011,101,"Processing and preserving of meat, except of poultry meat"
1012,101,Processing and preserving of poultry meat
1013,101,Production of meat and poultry meat products
102,10,"Processing and preserving of fish, crustaceans and molluscs"
1020,102,"Processing and preserving of fish, crustaceans and molluscs"
103,10,Processing and preserving of fruit and vegetables
1031,103,Processing and preserving of potatoes
1032,103,Manufacture of fruit and vegetable juice
1039,103,Other processing and preserving of fruit and vegetables
104,10,Manufacture of vegetable and animal oils and fats
1041,104,Manufacture of oils and fats
1042,104,Manufacture of margarine and similar edible fats
105,10,Manufacture of dairy products and edible ice
1051,105,Manufacture of dairy products
1052,105,Manufacture of ice cream and other edible ice
106,10,"Manufacture of grain mill products, starches and starch products"
1061,106,Manufacture of grain mill products
1062,106,Manufacture of starches and starch products
107,10,Manufacture of bakery and farinaceous products
1071,107,Manufacture of bread; manufacture of fresh pastry goods and cakes
1072,107,"Manufacture of rusks, biscuits, preserved pastries and cakes"
1073,107,Manufacture of farinaceous products
108,10,Manufacture of other food products
1081,108,Manufacture of sugar
1082,108,"Manufacture of cocoa, chocolate and sugar confectionery"
1083,108,Processing of tea and coffee
1084,108,Manufacture of condiments and seasonings
1085,108,Manufacture of prepared meals and dishes
1086,108,Manufacture of homogenised food preparations and dietetic food
1089,108,Manufacture of other food products n.e.c.
109,10,Manufacture of prepared animal feeds
1091,109,Manufacture of prepared feeds for farm animals
1092,109,Manufacture of prepared pet foods
11,C,Manufacture of beverages
110,11,Manufacture of beverages
1101,110,"Distilling, rectifying and blending of spirits"
1102,110,Manufacture of wine from grape
1103,110,Manufacture of cider and other fruit fermented beverages
1104,110,Manufacture of other non-distilled fermented beverages
1105,110,Manufacture of beer
1106,110,Manufacture of malt
1107,110,Manufacture of soft drinks and bottled waters
12,C,Manufacture of tobacco products
120,12,Manufacture of tobacco products
1200,120,Manufacture of tobacco products
13,C,Manufacture of textiles
131,13,Preparation and spinning of textile fibres
1310,131,Preparation and spinning of textile fibres
132,13,Weaving of textiles
1320,132,Weaving of textiles
133,13,Finishing of textiles
1330,133,Finishing of textiles
139,13,Manufacture of other textiles
1391,139,Manufacture of knitted and crocheted fabrics
1392,139,Manufacture of household textiles and made-up furnishing articles
1393,139,Manufacture of carpets and rugs
1394,139,"Manufacture of cordage, rope, twine and netting"
1395,139,Manufacture of non-wovens and non-woven articles
1396,139,Manufacture of other technical and industrial textiles
1399,139,Manufacture of other textiles n.e.c.
14,C,Manufacture of wearing apparel
141,14,Manufacture of knitted and crocheted apparel
1410,141,Manufacture of knitted and crocheted apparel
142,14,Manufacture of other wearing apparel and accessories
1421,142,Manufacture of outerwear
1422,142,Manufacture of underwear
1423,142,Manufacture of workwear
1424,142,Manufacture of leather clothes and fur apparel
1429,142,Manufacture of other wearing apparel and accessories n.e.c.
15,C,Manufacture of leather and related products of other materials
151,15,"Tanning, dyeing, dressing of leather and fur; manufacture of luggage, handbags, saddlery and harness"
1511,151,"Tanning, dressing, dyeing of leather and fur"
1512,151,"Manufacture of luggage, handbags, saddlery and harness of any material"
152,15,Manufacture of footwear
1520,152,Manufacture of footwear
16,C,"Manufacture of wood and of products of wood and cork, except furniture; manufacture of articles of straw and plaiting materials"
161,16,Sawmilling and planing of wood; processing and finishing of wood
1611,161,Sawmilling and planing of wood
1612,161,Processing and finishing of wood
162,16,"Manufacture of products of wood, cork, straw and plaiting materials"
1621,162,Manufacture of veneer sheets and wood-based panels
1622,162,Manufacture of assembled parquet floors
1623,162,Manufacture of other builders' carpentry and joinery
1624,162,Manufacture of wooden containers
1625,162,Manufacture of doors and windows of wood
1626,162,Manufacture of solid fuels from vegetable biomass
1627,162,Finishing of wooden products
1628,162,"Manufacture of other products of wood and articles of cork, straw and plaiting materials"
17,C,Manufacture of paper and paper products
171,17,"Manufacture of pulp, paper and paperboard"
1711,171,Manufacture of pulp
1712,171,Manufacture of paper and paperboard
172,17,Manufacture of articles of paper and paperboard
1721,172,"Manufacture of corrugated paper, paperboard and containers of paper and paperboard"
1722,172,Manufacture of household and sanitary goods and of toilet requisites
1723,172,Manufacture of paper stationery
1724,172,Manufacture of wallpaper
1725,172,Manufacture of other articles of paper and paperboard
18,C,Printing and reproduction of recorded media
181,18,Printing and service activities related to printing
1811,181,Printing of newspapers
1812,181,Other printing
1813,181,Pre-press and pre-media services
1814,181,Binding and related services
182,18,Reproduction of recorded media
1820,182,Reproduction of recorded media
19,C,Manufacture of coke and refined petroleum products
191,19,Manufacture of coke oven products
1910,191,Manufacture of coke oven products
192,19,Manufacture of refined petroleum products and fossil fuel products
1920,192,Manufacture of refined petroleum products and fossil fuel products
20,C,Manufacture of chemicals and chemical products
201,20,"Manufacture of basic chemicals, fertilisers and nitrogen compounds, plastics and synthetic rubber in primary forms"
2011,201,Manufacture of industrial gases
2012,201,Manufacture of dyes and pigments
2013,201,Manufacture of other inorganic basic chemicals
2014,201,Manufacture of other organic basic chemicals
2015,201,Manufacture of fertilisers and nitrogen compounds
2016,201,Manufacture of plastics in primary forms
2017,201,Manufacture of synthetic rubber in primary forms
202,20,"Manufacture of pesticides, disinfectants and other agrochemical products"
2020,202,"Manufacture of pesticides, disinfectants and other agrochemical products"
203,20,"Manufacture of paints, varnishes and similar coatings, printing ink and mastics"
2030,203,"Manufacture of paints, varnishes and similar coatings, printing ink and mastics"
204,20,"Manufacture of washing, cleaning and polishing preparations"
2041,204,"Manufacture of soap and detergents, cleaning and polishing preparations"
2042,204,Manufacture of perfumes and toilet preparations
205,20,Manufacture of other chemical products
2051,205,Manufacture of liquid biofuels
2059,205,Manufacture of other chemical products n.e.c.
206,20,Manufacture of man-made fibres
2060,206,Manufacture of man-made fibres
21,C,Manufacture of basic pharmaceutical products and pharmaceutical preparations
211,21,Manufacture of basic pharmaceutical products
2110,211,Manufacture of basic pharmaceutical products
212,21,Manufacture of pharmaceutical preparations
2120,212,Manufacture of pharmaceutical preparations
22,C,Manufacture of rubber and plastic products
221,22,Manufacture of rubber products
2211,221,"Manufacture, retreading and rebuilding of rubber tyres and manufacture of tubes"
2212,221,Manufacture of other rubber products
222,22,Manufacture of plastic products
2221,222,"Manufacture of plastic plates, sheets, tubes and profiles"
2222,222,Manufacture of plastic packing goods
2223,222,Manufacture of doors and windows of plastic
2224,222,Manufacture of builders’ ware of plastic
2225,222,Processing and finishing of plastic products
2226,222,Manufacture of other plastic products
23,C,Manufacture of other non-metallic mineral products
231,23,Manufacture of glass and glass products
2311,231,Manufacture of flat glass
2312,231,Shaping and processing of flat glass
2313,231,Manufacture of hollow glass
2314,231,Manufacture of glass fibres
2315,231,"Manufacture and processing of other glass, including technical glassware"
232,23,Manufacture of refractory products
2320,232,Manufacture of refractory products
233,23,Manufacture of clay building materials
2331,233,Manufacture of ceramic tiles and flags
2332,233,"Manufacture of bricks, tiles and construction products, in baked clay"
234,23,Manufacture of other porcelain and ceramic products
2341,234,Manufacture of ceramic household and ornamental articles
2342,234,Manufacture of ceramic sanitary fixtures
2343,234,Manufacture of ceramic insulators and insulating fittings
2344,234,Manufacture of other technical ceramic products
2345,234,Manufacture of other ceramic products
235,23,"Manufacture of cement, lime and plaster"
2351,235,Manufacture of cement
2352,235,Manufacture of lime and plaster
236,23,"Manufacture of articles of concrete, cement and plaster"
2361,236,Manufacture of concrete products for construction purposes
2362,236,Manufacture of plaster products for construction purposes
2363,236,Manufacture of ready-mixed concrete
2364,236,Manufacture of mortars
2365,236,Manufacture of fibre cement
2366,236,"Manufacture of other articles of concrete, cement and plaster"
237,23,"Cutting, shaping and finishing of stone"
2370,237,"Cutting, shaping and finishing of stone"
239,23,Manufacture of abrasive products and non-metallic mineral products n.e.c.
2391,239,Manufacture of abrasive products
2399,239,Manufacture of other non-metallic mineral products n.e.c.
24,C,Manufacture of basic metals
241,24,Manufacture of basic iron and steel and of ferro-alloys
2410,241,Manufacture of basic iron and steel and of ferro-alloys
242,24,"Manufacture of tubes, pipes, hollow profiles and related fittings, of steel"
2420,242,"Manufacture of tubes, pipes, hollow profiles and related fittings, of steel"
243,24,Manufacture of other products of first processing of steel
2431,243,Cold drawing of bars
2432,243,Cold rolling of narrow strip
2433,243,Cold forming or folding
2434,243,Cold drawing of wire
244,24,Manufacture of basic precious and other non-ferrous metals
2441,244,Precious metals production
2442,244,Aluminium production
2443,244,"Lead, zinc and tin production"
2444,244,Copper production
2445,244,Other non-ferrous metal production
2446,244,Processing of nuclear fuel
245,24,Casting of metals
2451,245,Casting of iron
2452,245,Casting of steel
2453,245,Casting of light metals
2454,245,Casting of other non-ferrous metals
25,C,"Manufacture of fabricated metal products, except machinery and equipment"
251,25,Manufacture of structural metal products
2511,251,Manufacture of metal structures and parts of structures
2512,251,Manufacture of doors and windows of metal
252,25,"Manufacture of tanks, reservoirs and containers of metal"
2521,252,"Manufacture of central heating radiators, steam generators and boilers"
2522,252,"Manufacture of other tanks, reservoirs and containers of metal"
253,25,Manufacture of weapons and ammunition
2530,253,Manufacture of weapons and ammunition
254,25,Forging and shaping metal and powder metallurgy
2540,254,Forging and shaping metal and powder metallurgy
255,25,Treatment and coating of metals; machining
2551,255,Coating of metals
2552,255,Heat treatment of metals
2553,255,Machining of metals
256,25,"Manufacture of cutlery, tools and general hardware"
2561,256,Manufacture of cutlery
2562,256,Manufacture of locks and hinges
2563,256,Manufacture of tools
259,25,Manufacture of other fabricated metal products
2591,259,Manufacture of steel drums and similar containers
2592,259,Manufacture of light metal packaging
2593,259,"Manufacture of wire products, chain and springs"
2594,259,Manufacture of fasteners and screw machine products
2599,259,Manufacture of other fabricated metal products n.e.c.
26,C,"Manufacture of computer, electronic and optical products"
261,26,Manufacture of electronic components and boards
2611,261,Manufacture of electronic components
2612,261,Manufacture of loaded electronic boards
262,26,Manufacture of computers and peripheral equipment
2620,262,Manufacture of computers and peripheral equipment
263,26,Manufacture of communication equipment
2630,263,Manufacture of communication equipment
264,26,Manufacture of consumer electronics
2640,264,Manufacture of consumer electronics
265,26,"Manufacture of measuring testing instruments, clocks and watches"
2651,265,"Manufacture of instruments and appliances for measuring, testing and navigation"
2652,265,Manufacture of watches and clocks
266,26,"Manufacture of irradiation, electromedical and electrotherapeutic equipment"
2660,266,"Manufacture of irradiation, electromedical and electrotherapeutic equipment"
267,26,"Manufacture of optical instruments, magnetic and optical media and photographic equipment"
2670,267,"Manufacture of optical instruments, magnetic and optical media and photographic equipment"
27,C,Manufacture of electrical equipment
271,27,"Manufacture of electric motors, generators, transformers and electricity distribution and control apparatus"
2711,271,"Manufacture of electric motors, generators and transformers"
2712,271,Manufacture of electricity distribution and control apparatus
272,27,Manufacture of batteries and accumulators
2720,272,Manufacture of batteries and accumulators
273,27,Manufacture of wiring and wiring devices
2731,273,Manufacture of fibre optic cables
2732,273,Manufacture of other electronic and electric wires and cables
2733,273,Manufacture of wiring devices
274,27,Manufacture of lighting equipment
2740,274,Manufacture of lighting equipment
275,27,Manufacture of domestic appliances
2751,275,Manufacture of electric domestic appliances
2752,275,Manufacture of non-electric domestic appliances
279,27,Manufacture of other electrical equipment
2790,279,Manufacture of other electrical equipment
28,C,Manufacture of machinery and equipment n.e.c.
281,28,Manufacture of general-purpose machinery
2811,281,"Manufacture of engines and turbines, except aircraft, vehicle and cycle engines"
2812,281,Manufacture of fluid power equipment
2813,281,Manufacture of other pumps and compressors
2814,281,Manufacture of other taps and valves
2815,281,"Manufacture of bearings, gears, gearing and driving elements"
282,28,Manufacture of other general-purpose machinery
2821,282,"Manufacture of ovens, furnaces and permanent household heating equipment"
2822,282,Manufacture of lifting and handling equipment
2823,282,"Manufacture of office machinery and equipment, except computers and peripheral equipment"
2824,282,Manufacture of power-driven hand tools
2825,282,Manufacture of non-domestic air conditioning equipment
2829,282,Manufacture of other general-purpose machinery n.e.c.
283,28,Manufacture of agricultural and forestry machinery
2830,283,Manufacture of agricultural and forestry machinery
284,28,Manufacture of metal forming machinery and machine tools
2841,284,Manufacture of metal forming machinery and machine tools for metal work
2842,284,Manufacture of other machine tools
289,28,Manufacture of other special-purpose machinery
2891,289,Manufacture of machinery for metallurgy
2892,289,"Manufacture of machinery for mining, quarrying and construction"
2893,289,"Manufacture of machinery for food, beverage and tobacco processing"
2894,289,"Manufacture of machinery for textile, apparel and leather production"
2895,289,Manufacture of machinery for paper and paperboard production
2896,289,Manufacture of plastics and rubber machinery
2897,289,Manufacture of additive manufacturing machinery
2899,289,Manufacture of other special-purpose machinery n.e.c.
29,C,"Manufacture of motor vehicles, trailers and semi-trailers"
291,29,Manufacture of motor vehicles
2910,291,Manufacture of motor vehicles
292,29,Manufacture of bodies and coachwork for motor vehicles; manufacture of trailers and semi-trailers
2920,292,Manufacture of bodies and coachwork for motor vehicles; manufacture of trailers and semi-trailers
293,29,Manufacture of motor vehicle parts and accessories
2931,293,Manufacture of electrical and electronic equipment for motor vehicles
2932,293,Manufacture of other parts and accessories for motor vehicles
30,C,Manufacture of other transport equipment
301,30,Building of ships and boats
3011,301,Building of civilian ships and floating structures
3012,301,Building of pleasure and sporting boats
3013,301,Building of military ships and vessels
302,30,Manufacture of railway locomotives and rolling stock
3020,302,Manufacture of railway locomotives and rolling stock
303,30,Manufacture of air and spacecraft and related machinery
3031,303,Manufacture of civilian air and spacecraft and related machinery
3032,303,Manufacture of military air and spacecraft and related machinery
304,30,Manufacture of military fighting vehicles
3040,304,Manufacture of military fighting vehicles
309,30,Manufacture of transport equipment n.e.c.
3091,309,Manufacture of motorcycles
3092,309,Manufacture of bicycles and invalid carriages
3099,309,Manufacture of other transport equipment n.e.c.
31,C,Manufacture of furniture
310,31,Manufacture of furniture
3100,310,Manufacture of furniture
32,C,Other manufacturing
321,32,"Manufacture of jewellery, bijouterie and related articles"
3211,321,Striking of coins
3212,321,Manufacture of jewellery and related articles
3213,321,Manufacture of imitation jewellery and related articles
322,32,Manufacture of musical instruments
3220,322,Manufacture of musical instruments
323,32,Manufacture of sports goods
3230,323,Manufacture of sports goods
324,32,Manufacture of games and toys
3240,324,Manufacture of games and toys
325,32,Manufacture of medical and dental instruments and supplies
3250,325,Manufacture of medical and dental instruments and supplies
329,32,Manufacturing n.e.c.
3291,329,Manufacture of brooms and brushes
3299,329,Other manufacturing n.e.c.
33,C,"Repair, maintenance and installation of machinery and equipment"
331,33,"Repair and maintenance of fabricated metal products, machinery and equipment"
3311,331,Repair and maintenance of fabricated metal products
3312,331,Repair and maintenance of machinery
3313,331,Repair and maintenance of electronic and optical equipment
3314,331,Repair and maintenance of electrical equipment
3315,331,Repair and maintenance of civilian ships and boats
3316,331,Repair and maintenance of civilian air and spacecraft
3317,331,Repair and maintenance of other civilian transport equipment
3318,331,"Repair and maintenance of military fighting vehicles, ships, boats, air and spacecraft"
3319,331,Repair and maintenance of other equipment
332,33,Installation of industrial machinery and equipment
3320,332,Installation of industrial machinery and equipment
D,,"ELECTRICITY, GAS, STEAM AND AIR CONDITIONING SUPPLY"
35,D,"Electricity, gas, steam and air conditioning supply"
351,35,"Electric power generation, transmission and distribution"
3511,351,Production of electricity from non-renewable sources
3512,351,Production of electricity from renewable sources
3513,351,Transmission of electricity
3514,351,Distribution of electricity
3515,351,Trade of electricity
3516,351,Storage of electricity
352,35,"Manufacture of gas, and distribution of gaseous fuels through mains"
3521,352,Manufacture of gas
3522,352,Distribution of gaseous fuels through mains
3523,352,Trade of gas through mains
3524,352,Storage of gas as part of network supply services
353,35,Steam and air conditioning supply
3530,353,Steam and air conditioning supply
354,35,Activities of brokers and agents for electric power and natural gas
3540,354,Activities of brokers and agents for electric power and natural gas
E,,"WATER SUPPLY; SEWERAGE, WASTE MANAGEMENT AND REMEDIATION ACTIVITIES"
36,E,"Water collection, treatment and supply"
360,36,"Water collection, treatment and supply"
3600,360,"Water collection, treatment and supply"
37,E,Sewerage
370,37,Sewerage
3700,370,Sewerage
38,E,"Waste collection, recovery and disposal activities"
381,38,Waste collection
3811,381,Collection of non-hazardous waste
3812,381,Collection of hazardous waste
382,38,Waste recovery
3821,382,Materials recovery
3822,382,Energy recovery
3823,382,Other waste recovery
383,38,Waste disposal without recovery
3831,383,Incineration without energy recovery
3832,383,Landfilling or permanent storage
3833,383,Other waste disposal
39,E,Remediation activities and other waste management service activities
390,39,Remediation activities and other waste management service activities
3900,390,Remediation activities and other waste management service activities
F,,CONSTRUCTION
41,F,Construction of residential and non-residential buildings
410,41,Construction of residential and non-residential buildings
4100,410,Construction of residential and non-residential buildings
42,F,Civil engineering
421,42,Construction of roads and railways
4211,421,Construction of roads and motorways
4212,421,Construction of railways and underground railways
4213,421,Construction of bridges and tunnels
422,42,Construction of utility projects
4221,422,Construction of utility projects for fluids
4222,422,Construction of utility projects for electricity and telecommunications
429,42,Construction of other civil engineering projects
4291,429,Construction of water projects
4299,429,Construction of other civil engineering projects n.e.c.
43,F,Specialised construction activities
431,43,Demolition and site preparation
4311,431,Demolition
4312,431,Site preparation
4313,431,Test drilling and boring
432,43,"Electrical, plumbing and other construction installation activities"
4321,432,Electrical installation
