code,parent,label_en
9112,911,Archive activities
912,91,"Museum, collection, historical site and monument activities"
9121,912,Museum and collection activities
9122,912,Historical site and monument activities
913,91,"Conservation, restoration and other support activities for cultural heritage"
9130,913,"Conservation, restoration and other support activities for cultural heritage"
914,91,Botanical and zoological garden and nature reserve activities
9141,914,Botanical and zoological garden activities
9142,914,Nature reserve activities
92,S,Gambling and betting activities
920,92,Gambling and betting activities
9200,920,Gambling and betting activities
93,S,Sports activities and amusement and recreation activities
931,93,Sports activities
9311,931,Operation of sports facilities
9312,931,Activities of sports clubs
9313,931,Activities of fitness centres
9319,931,Sports activities n.e.c.
932,93,Amusement and recreation activities
9321,932,Activities of amusement parks and theme parks
9329,932,Amusement and recreation activities n.e.c.
T,,OTHER SERVICE ACTIVITIES
94,T,Activities of membership organisations
941,94,"Activities of business, employers and professional membership organisations"
9411,941,Activities of business and employers membership organisations
9412,941,Activities of professional membership organisations
942,94,Activities of trade unions
9420,942,Activities of trade unions
949,94,Activities of other membership organisations
9491,949,Activities of religious organisations
9492,949,Activities of political organisations
9499,949,Activities of other membership organisations n.e.c.
95,T,"Repair and maintenance of computers, personal and household goods, and motor vehicles and motorcycles"
951,95,Repair and maintenance of computers and communication equipment
9510,951,Repair and maintenance of computers and communication equipment
952,95,Repair and maintenance of personal and household goods
9521,952,Repair and maintenance of consumer electronics
9522,952,Repair and maintenance of household appliances and home and garden equipment
9523,952,Repair and maintenance of footwear and leather goods
9524,952,Repair and maintenance of furniture and home furnishings
9525,952,"Repair and maintenance of watches, clocks and jewellery"
9529,952,Repair and maintenance of personal and household goods n.e.c.
953,95,Repair and maintenance of motor vehicles and motorcycles
9531,953,Repair and maintenance of motor vehicles
9532,953,Repair and maintenance of motorcycles
954,95,"Intermediation service activities for repair and maintenance of computers, personal and household goods, and motor vehicles and motorcycles"
9540,954,"Intermediation service activities for repair and maintenance of computers, personal and household goods, and motor vehicles and motorcycles"
96,T,Personal service activities
961,96,Washing and cleaning of textile and fur products
9610,961,Washing and cleaning of textile and fur products
962,96,"Hairdressing, beauty treatment, day spa and similar activities"
9621,962,Hairdressing and barber activities
9622,962,Beauty care and other beauty treatment activities
9623,962,"Day spa, sauna and steam bath activities"
963,96,Funeral and related activities
9630,963,Funeral and related activities
964,96,Intermediation service activities for personal services
9640,964,Intermediation service activities for personal services
969,96,Other personal service activities
9691,969,Provision of domestic personal service activities
9699,969,Other personal service activities n.e.c.
U,,ACTIVITIES OF HOUSEHOLDS AS EMPLOYERS AND UNDIFFERENTIATED GOODS - AND SERVICE-PRODUCING ACTIVITIES OF HOUSEHOLDS FOR OWN USE
97,U,Activities of households as employers of domestic personnel
970,97,Activities of households as employers of domestic personnel
9700,970,Activities of households as employers of domestic personnel
98,U,Undifferentiated goods- and service-producing activities of private households for own use
981,98,Undifferentiated goods-producing activities of private households for own use
9810,981,Undifferentiated goods-producing activities of private households for own use
982,98,Undifferentiated service-producing activities of private households for own use
9820,982,Undifferentiated service-producing activities of private households for own use
V,,ACTIVITIES OF EXTRATERRITORIAL ORGANISATIONS AND BODIES
99,V,Activities of extraterritorial organisations and bodies
990,99,Activities of extraterritorial organisations and bodies
9900,990,Activities of extraterritorial organisations and bodies
